{"bundle":"paper/methodology.md.bundle","covered":[{"bundle_path":"sources/source-50.json","path":"schema/daily-anchor.schema.json","sha256":"sha256:e1ac5a97e0e55f0e3453b347c9484f1852f3fd0413cb920557a1f2fab3fe9e03","source_id":"S-0050"},{"bundle_path":"sources/source-51.json","path":"examples/daily-anchor-payload/default-anchor.json","sha256":"sha256:8c4613be52de468fbcc662fae33e200c54fd3703eb8871474a58b3245905a375","source_id":"S-0051"},{"bundle_path":"sources/source-52.md","path":"examples/daily-anchor-payload/README.md","sha256":"sha256:20bae3261073afb8ecad10a8351bf1cdbbbf2c2166d56e5cba49a15aac7d20e5","source_id":"S-0052"},{"bundle_path":"sources/source-49.json","path":"schema/daily-roll-up.schema.json","sha256":"sha256:1630eae6ca3cd7ea996cc8de5adc1ef2fd107ce492e40ad89d3418d3b43a89f4","source_id":"S-0049"},{"bundle_path":"sources/source-53.json","path":"examples/daily-roll-up-payload/default-rollup.json","sha256":"sha256:bc0b31e2755d87fd1a134d748c4a051700f591723ab8e37ceb7e606dea71963b","source_id":"S-0053"},{"bundle_path":"sources/source-54.md","path":"examples/daily-roll-up-payload/README.md","sha256":"sha256:bd92732b30f820daab432a06d93252a7196af133d05821c133dc9b7e1ea3ac8a","source_id":"S-0054"},{"bundle_path":"sources/source-6.json","path":"schema/roll-up-cli-payload.schema.json","sha256":"sha256:4a4556d3ef08345ecfd5346474984928e3f75837922899aa51b0e51d112d052b","source_id":"S-0006"},{"bundle_path":"sources/source-7.json","path":"examples/roll-up-cli-payload/bad-unsafe-boundary.json","sha256":"sha256:4f0da94882ed9f2cbabe6bc1226a79c92ef711318f8fecce7b5e92d3d1a65320","source_id":"S-0007"},{"bundle_path":"sources/source-56.json","path":"examples/roll-up-cli-payload/bad-unsafe-diagnostic-summary-example.json","sha256":"sha256:f7b48ff7de470b28ac6eb1481b30649543f294b8883c2618cf820a2099700634","source_id":"S-0056"},{"bundle_path":"sources/source-8.json","path":"examples/roll-up-cli-payload/default-output-required-fields.json","sha256":"sha256:640b1debb1c2c3952dafd8310895435fa52b327571e3aa77e9870ff90ef70339","source_id":"S-0008"},{"bundle_path":"sources/source-9.md","path":"examples/roll-up-cli-payload/POLICY.md","sha256":"sha256:790054f782f4ef72d3f752e7dc365b5e6ec2ea5e7b066f88f5e2184e336b5ee2","source_id":"S-0009"},{"bundle_path":"sources/source-12.json","path":"schema/methodology-bundle-coverage.schema.json","sha256":"sha256:a7f7970f7222c24fa72f7ce15ba7575f8060c3bcfe4fad305ba03c20ab6cab87","source_id":"S-0012"},{"bundle_path":"sources/source-13.json","path":"examples/methodology-bundle-coverage/bad-unsafe-boundary.json","sha256":"sha256:f7f8f5a4a720e10cf8e7b798dde3e5f64ed924ad166cee484f9d3af616aefec5","source_id":"S-0013"},{"bundle_path":"sources/source-14.json","path":"examples/methodology-bundle-coverage/missing-manifest.json","sha256":"sha256:59af660ae79859d8b4d4c0a2379d2c5a36455ab5c98313fcd711286b28805c7d","source_id":"S-0014"},{"bundle_path":"sources/source-10.md","path":"examples/methodology-bundle-coverage/POLICY.md","sha256":"sha256:cee2a437e4a9cab816faaa3080d4a5b7341c572d3155ab6aa23eb86606496172","source_id":"S-0010"},{"bundle_path":"sources/source-22.json","path":"schema/reviewer-report-packet.schema.json","sha256":"sha256:64d3f772fbc62c8cccd4f7a1b5868c2810b0e57b583225e781eb8705764ad296","source_id":"S-0022"},{"bundle_path":"sources/source-35.json","path":"examples/reviewer-report-packet/bad-hash-report.json","sha256":"sha256:ce5a80aae533a1f5c814126d8d93bd2e3d65fa88fcf1bdc29b7acd0172e5f477","source_id":"S-0035"},{"bundle_path":"sources/source-24.json","path":"examples/reviewer-report-packet/bad-quality-grade.json","sha256":"sha256:a126e5c356b905664c3c13604e75fa7de2b2ce7ca3509469e5a7e8eee79c72d3","source_id":"S-0024"},{"bundle_path":"sources/source-23.json","path":"examples/reviewer-report-packet/default-report.json","sha256":"sha256:362cc0b7f88ec1aee9bf74a7925ebab67b161145f6351fdf47cd16bc2178f2be","source_id":"S-0023"},{"bundle_path":"sources/source-36.json","path":"examples/reviewer-report-packet/missing-bundle-failure.json","sha256":"sha256:779ceef942844c4b5000d59039e9c6651b9d3211e380e66b79d58930eda9dc33","source_id":"S-0036"},{"bundle_path":"sources/source-25.md","path":"examples/reviewer-report-packet/POLICY.md","sha256":"sha256:2f2e7b8e041db0a88f3d1e228ba520ab791a2946ae4d435389eab01cc156d505","source_id":"S-0025"},{"bundle_path":"sources/source-33.py","path":"reviewer_report_packet.py","sha256":"sha256:c381e2a9582bd8180a17b7d3c54eab3d4ca0a7d6d614e9f4f450241d79bc960e","source_id":"S-0033"},{"bundle_path":"sources/source-27.json","path":"schema/signed-transition-profile.schema.json","sha256":"sha256:da89527ac91f367aadd71b1e515ee1141ebc30af5cf461a636625eeda89da20b","source_id":"S-0027"},{"bundle_path":"sources/source-29.json","path":"examples/signed-transition-profile/bad-upgrade-language.json","sha256":"sha256:53fc5262bd6cd304ae3b11b751e9254364ef719c4319d02ef8bae8ca6432a251","source_id":"S-0029"},{"bundle_path":"sources/source-28.json","path":"examples/signed-transition-profile/default-transition.json","sha256":"sha256:8005f31693b3c59b5c109373dea8595d7de997d5c9bfa6e8929a603afe77fddf","source_id":"S-0028"},{"bundle_path":"sources/source-37.json","path":"examples/signed-transition-profile/missing-input-failure.json","sha256":"sha256:f00086f975b134e461f13a6957cfcff2804fd33fdb5f29242be4ca26d5b3ae2c","source_id":"S-0037"},{"bundle_path":"sources/source-40.json","path":"examples/signed-transition-profile/missing-reviewer-failure.json","sha256":"sha256:5d15a6c113eab912a0cf35c8aacf1bc6c7347c1a5122ec406c8f5bcdd1223bba","source_id":"S-0040"},{"bundle_path":"sources/source-30.md","path":"examples/signed-transition-profile/POLICY.md","sha256":"sha256:e5c2297c9aa9d4adfeb5aff8305f3984225196f3076d7280a0395474f88ca01e","source_id":"S-0030"},{"bundle_path":"sources/source-31.py","path":"signed_transition_profile.py","sha256":"sha256:ed5b7dd5a8da5c855014aa339de8cf58782861e318eea994a4e18adeb213b999","source_id":"S-0031"},{"bundle_path":"sources/source-41.md","path":"examples/bad-artifact-traversal/README.md","sha256":"sha256:75cc43beba2b84f080600b0d58430df456150d3777ddd7fb2e21e2ef8d8372e6","source_id":"S-0041"},{"bundle_path":"sources/source-42.md","path":"examples/bad-unsafe-assurance/README.md","sha256":"sha256:57fc861b4d64390bf2a0d30e09dba0e496c223150442e179928ce86042a4218f","source_id":"S-0042"},{"bundle_path":"sources/source-47.json","path":"schema/verifier-output.schema.json","sha256":"sha256:22e2355c5f7f25200f9ebfb44c2370642c62f4ed73f2c4355a7d7afd5b70740c","source_id":"S-0047"},{"bundle_path":"sources/source-45.json","path":"examples/verifier-output/bad-hash-integrity-failure.json","sha256":"sha256:85c4c16121540777a8d75d413619effd04c9f02f02219a5cd639f7ece8785598","source_id":"S-0045"},{"bundle_path":"sources/source-43.json","path":"examples/verifier-output/bad-unsafe-assurance-policy-failure.json","sha256":"sha256:1e00e1499c0aee3f4087391a859db41f86028086c8f4210dd2f2df1e97762388","source_id":"S-0043"},{"bundle_path":"sources/source-48.json","path":"examples/verifier-output/good-success.json","sha256":"sha256:a1653880e2c2e536035ce5ca4217d12ea6ce43ba684ed9294796f3039d4136fe","source_id":"S-0048"},{"bundle_path":"sources/source-46.json","path":"examples/verifier-output/mixed-policy-and-integrity-failure.json","sha256":"sha256:712ca3534ecf2e6814eff92103cd68d929c431c9dbb9da957b193dc2857e7064","source_id":"S-0046"},{"bundle_path":"sources/source-44.md","path":"examples/verifier-output/README.md","sha256":"sha256:4c7aa7bd142c6e433f5505bc950867f3c60ccfa972e5641583a50dddb72d25f0","source_id":"S-0044"}],"covered_count":37,"missing":[],"missing_count":0,"required_count":37,"safe_interpretation":"This summary reports local methodology-bundle source coverage for semantic fixtures only; it does not certify sibling-lane completeness, publication readiness, audit status, or legal/regulatory status.","status":"ok"}
